{
  "contract_version": "telemetry-bundle-v1",
  "bundle_id": "telemetry-implementation-otel-optional-001",
  "producer": {
    "kind": "implementation",
    "id": "example-implementation",
    "version": "1.2.3",
    "description": "Optional implementation telemetry originally produced by an external telemetry system.",
    "telemetry_system": "opentelemetry"
  },
  "run_binding": {
    "run_id": "run-diagnostic-otel-001",
    "cell_id": "cell-http2-otel-telemetry",
    "repetition": 0,
    "scenario_id": "http2.core.plaintext",
    "scenario_version": "1.0.0",
    "suite_id": "conformance-smoke",
    "protocol": "h2",
    "implementation_id": "example-implementation",
    "test_executor_id": "example-test-executor",
    "load_profile_id": "smoke",
    "execution_profile": "diagnostic"
  },
  "measurement_profile": {
    "profile_id": "diagnostic",
    "claim_level": "diagnostic",
    "measurement_expectations": ["optional implementation diagnostic span correlation"],
    "comparability_floor": "same-run",
    "heavy_instrumentation_disclosed": true,
    "warnings": ["External telemetry correlation is optional and is not a ProtocolLab canonical field model."]
  },
  "comparability": {
    "class": "same-run",
    "statement": "This optional diagnostic bundle supports same-run investigation only."
  },
  "created_at_utc": "2026-06-14T13:30:00Z",
  "samples": [
    {
      "metric_name": "implementation.request_queue_depth",
      "metric_kind": "gauge",
      "value": 2,
      "unit": "items",
      "timestamp_utc": "2026-06-14T13:30:04Z",
      "source": {
        "kind": "implementation",
        "id": "example-implementation",
        "telemetry_system": "opentelemetry"
      },
      "scope": "implementation",
      "collector_id": "implementation-optional-otel-export",
      "tags": {
        "lane": "h2"
      },
      "provenance": {
        "observed_by": "implementation",
        "method": "external telemetry values normalized into ProtocolLab sample shape",
        "confidence": "derived"
      },
      "external_correlation": {
        "system": "opentelemetry",
        "trace_id": "0af7651916cd43dd8448eb211c80319c",
        "span_id": "b7ad6b7169203331"
      },
      "warnings": []
    }
  ],
  "summaries": [],
  "collectors": [
    {
      "collector_id": "implementation-optional-otel-export",
      "collector_version": "1.0",
      "collector_kind": "implementation-export",
      "source": {
        "kind": "implementation",
        "id": "example-implementation",
        "telemetry_system": "opentelemetry"
      },
      "scope": "implementation",
      "required": false,
      "availability": "partial",
      "configuration_summary": {
        "external_correlation_retained": true
      },
      "overhead_risk": "medium",
      "warnings": ["Diagnostic instrumentation may affect comparability."]
    }
  ],
  "artifacts": [],
  "warnings": ["OpenTelemetry is shown only as an optional producer system, not a required ProtocolLab dependency."],
  "errors": [],
  "redaction": {
    "state": "producer-declared-safe",
    "reviewed_at_utc": "2026-06-14T13:31:00Z",
    "reviewed_by": "fixture-author"
  },
  "external_correlation": {
    "system": "opentelemetry",
    "correlation_id": "example-run-correlation"
  }
}
